{
  "schema_version": "1.0.0",
  "run_id": "run_01J6ZK3M8Q0X4V9R2T7B5N1C6D",
  "created_at": "2026-09-02T10:30:00Z",
  "run": {
    "state": "DELIVERED",
    "channel": "self_service",
    "request_ref": {
      "artifact_id": "req_01J6ZK3M5D8P2W6Y0A4C8E2G6J",
      "artifact_type": "analysis-run-request"
    }
  },
  "artifacts": {
    "website_evidence_baseline": {
      "artifact_id": "wev_baseline_0001",
      "artifact_type": "website-evidence"
    },
    "website_evidence_targeted": {
      "artifact_id": "wev_targeted_0001",
      "artifact_type": "website-evidence"
    },
    "business_context": { "artifact_id": "bctx_0001", "artifact_type": "business-context" },
    "business_intent_set": { "artifact_id": "bis_0001", "artifact_type": "business-intent-set" },
    "contextual_diagnosis": { "artifact_id": "cdx_0001", "artifact_type": "contextual-diagnosis" },
    "scorecard": { "artifact_id": "sc_0001", "artifact_type": "scorecard" },
    "product_diagnosis": { "artifact_id": "pdx_0001", "artifact_type": "product-diagnosis" },
    "client_report_model": { "artifact_id": "crm_0001", "artifact_type": "client-report-model" },
    "customer_report_render": {
      "artifact_id": "render_0001",
      "artifact_type": "customer-report-render"
    }
  },
  "delivery_records": [{ "artifact_id": "dlv_0001", "artifact_type": "delivery-record" }],
  "measurement_refs": [
    { "artifact_id": "meas_01J6ZK3N2A7C9E1G3I5K7M9O1Q", "artifact_type": "measurement-record" },
    { "artifact_id": "meas_01J6ZK3N2A7C9E1G3I5K7M9O1S", "artifact_type": "measurement-record" }
  ],
  "validations": [
    {
      "validation_id": "val_contract_conformance",
      "status": "PASS",
      "checked_at": "2026-09-02T10:28:00Z",
      "detail_ref": { "artifact_id": "valrep_0001", "artifact_type": "validation-report" }
    },
    {
      "validation_id": "val_customer_leakage_gate",
      "status": "PASS",
      "checked_at": "2026-09-02T10:28:05Z"
    },
    {
      "validation_id": "val_score_consistency",
      "status": "PASS",
      "checked_at": "2026-09-02T10:28:10Z"
    }
  ]
}
